{
  "$schema": "./schemas/levels.schema.json",
  "schemaVersion": "1.0.0",
  "version": "1.0.0",
  "maps": {
    "julu": {
      "symmetry": "rotate-180",
      "lanes": [
        [
          { "r": 0, "c": 7 },
          { "r": 1, "c": 7 },
          { "r": 1, "c": 6 },
          { "r": 1, "c": 5 },
          { "r": 1, "c": 4 },
          { "r": 2, "c": 4 },
          { "r": 2, "c": 5 },
          { "r": 2, "c": 6 },
          { "r": 2, "c": 7 },
          { "r": 3, "c": 7 },
          { "r": 3, "c": 6 },
          { "r": 3, "c": 5 },
          { "r": 3, "c": 4 },
          { "r": 3, "c": 3 },
          { "r": 3, "c": 2 },
          { "r": 3, "c": 1 },
          { "r": 3, "c": 0 },
          { "r": 2, "c": 0 },
          { "r": 2, "c": 1 },
          { "r": 2, "c": 2 },
          { "r": 1, "c": 2 },
          { "r": 1, "c": 1 },
          { "r": 1, "c": 0 },
          { "r": 0, "c": 0 }
        ],
        [
          { "r": 9, "c": 0 },
          { "r": 8, "c": 0 },
          { "r": 8, "c": 1 },
          { "r": 8, "c": 2 },
          { "r": 8, "c": 3 },
          { "r": 7, "c": 3 },
          { "r": 7, "c": 2 },
          { "r": 7, "c": 1 },
          { "r": 7, "c": 0 },
          { "r": 6, "c": 0 },
          { "r": 6, "c": 1 },
          { "r": 6, "c": 2 },
          { "r": 6, "c": 3 },
          { "r": 6, "c": 4 },
          { "r": 6, "c": 5 },
          { "r": 6, "c": 6 },
          { "r": 6, "c": 7 },
          { "r": 7, "c": 7 },
          { "r": 7, "c": 6 },
          { "r": 7, "c": 5 },
          { "r": 8, "c": 5 },
          { "r": 8, "c": 6 },
          { "r": 8, "c": 7 },
          { "r": 9, "c": 7 }
        ]
      ],
      "openCells": [
        { "r": 0, "c": 2 },
        { "r": 0, "c": 3 },
        { "r": 0, "c": 4 },
        { "r": 4, "c": 2 },
        { "r": 4, "c": 3 },
        { "r": 4, "c": 4 },
        { "r": 4, "c": 5 },
        { "r": 5, "c": 2 },
        { "r": 5, "c": 3 },
        { "r": 5, "c": 4 },
        { "r": 5, "c": 5 },
        { "r": 9, "c": 3 },
        { "r": 9, "c": 4 },
        { "r": 9, "c": 5 }
      ],
      "spawnCells": [
        { "r": 0, "c": 7 },
        { "r": 9, "c": 0 }
      ],
      "gateCells": [
        { "r": 0, "c": 0 },
        { "r": 9, "c": 7 }
      ],
      "spawnDecorationId": "bramble",
      "legacyPathLane": 0
    }
  },
  "stages": [
    {
      "id": "star-1",
      "name": "烽燧初战",
      "star": 1,
      "mapId": "julu",
      "featuredHero": "zhaoyun",
      "waveCount": 5,
      "enemyHpMul": 0.85,
      "finalEnemy": "elite",
      "enemyPlan": { "fastFromWave": 4, "tankFromWave": 7 }
    },
    {
      "id": "star-2",
      "name": "疾骑突阵",
      "star": 2,
      "mapId": "julu",
      "featuredHero": "guanyu",
      "waveCount": 5,
      "enemyHpMul": 0.95,
      "finalEnemy": "elite",
      "enemyPlan": { "fastFromWave": 3, "tankFromWave": 5 }
    },
    {
      "id": "star-3",
      "name": "巨甲压境",
      "star": 3,
      "mapId": "julu",
      "featuredHero": "zhangfei",
      "waveCount": 5,
      "enemyHpMul": 1,
      "finalEnemy": "elite",
      "enemyPlan": { "fastFromWave": 3, "tankFromWave": 4 }
    },
    {
      "id": "star-4",
      "name": "悍将破围",
      "star": 4,
      "mapId": "julu",
      "featuredHero": "huangzhong",
      "waveCount": 5,
      "enemyHpMul": 1.1,
      "finalEnemy": "elite",
      "enemyPlan": { "fastFromWave": 2, "tankFromWave": 3 }
    },
    {
      "id": "star-5",
      "name": "魁首决战",
      "star": 5,
      "mapId": "julu",
      "featuredHero": "liubei",
      "waveCount": 5,
      "enemyHpMul": 1.15,
      "finalEnemy": "boss",
      "enemyPlan": { "fastFromWave": 2, "tankFromWave": 3 }
    }
  ]
}
